{
  "$schema": "./audio-replacement-audit.schema.json",
  "schemaVersion": 2,
  "auditId": "canonical-audio-loudness-2026-08-06",
  "auditedAt": "2026-08-06",
  "updatedAt": "2026-08-07T08:02:59Z",
  "status": "rss_com_remote_replacement_verified_downstream_refresh_unverified",
  "canonicalFeedUrl": "https://media.rss.com/dr-m-experienced/feed.xml",
  "measurement": {
    "tool": "ffmpeg loudnorm full-file analysis",
    "audioStream": "0:a:0",
    "targetIntegratedLufs": -16,
    "integratedToleranceLufs": 1,
    "maximumTruePeakDbtp": -1,
    "acceptanceIntegratedRangeLufs": [
      -17,
      -15
    ]
  },
  "protectedIdentityFields": [
    "RSS GUID",
    "episode number",
    "publication date",
    "episode title",
    "episode artwork",
    "Spotify episode ID",
    "active YouTube video ID and archived predecessor ID",
    "Vimeo video ID",
    "Rumble video ID"
  ],
  "localDelivery": {
    "batchId": "20260806T2253-0600-first-seven-loudness-v2",
    "manifestSha256": "d1e31257597f905835d5ed1cac37d7017a3c4f1babba61908c44a7c1c7970f70",
    "sourceMeasurementsSha256": "2c547683cb8c5fecb8ff7aead759270d5deb7f9949e6102bc3e4b590db4f8b51",
    "status": "validated_local_delivery",
    "validatedAt": "2026-08-06T23:14:33-06:00",
    "integratedAt": "2026-08-07T05:20:25.932Z",
    "catalogRevision": 7,
    "uploadAuthorized": false,
    "uploadsPerformed": false
  },
  "episodes": [
    {
      "number": 1,
      "title": "Brain Fog, Part 1 - Is Your Brain in a Fog?",
      "rssGuid": "c9b853b6-a828-4012-9998-217919ff9163",
      "publishedAudioBaseline": {
        "measuredAt": "2026-08-06",
        "integratedLufs": -28.75,
        "truePeakDbtp": -7.5,
        "status": "published_pending_replacement"
      },
      "correctedSourceRender": {
        "sha256": "5be4feefbdca2417e8a97527ea3f13d072bb07b0549127d590998f1977c6dd60",
        "integratedLufs": -22.51,
        "truePeakDbtp": -1.18,
        "measurementEvidenceSha256": "961cfe596b3774d6fb21c9f1c76d75a102a17c93479664513aae5ae8d1af559a",
        "decodeEvidenceSha256": "c989710107a789306ffb61650ab3161ef8fcbf3ae03f1506e82318e2f69cf80c",
        "assessment": "under_delivery_target"
      },
      "validatedDelivery": {
        "status": "validated_local_delivery",
        "sourceMode": "validated_v1_candidate",
        "completedAt": "2026-08-06T23:03:26-06:00",
        "masterVideo": {
          "assetId": "episode-001-master-video",
          "sha256": "bc873595eb688c19a1684af6d4bfac720a9afb2d4c4b017ecc299e4e673716d5",
          "sizeBytes": 936971338,
          "durationSeconds": 1021.2,
          "integratedLufs": -16.21,
          "truePeakDbtp": -1.32
        },
        "podcastAudio": {
          "assetId": "episode-001-podcast-audio",
          "sha256": "4d7821bbd98fb7830100f8af415a17f68b803043c1b6bb09429f51b56c746d5a",
          "sizeBytes": 24509421,
          "durationSeconds": 1021.2,
          "integratedLufs": -16.47,
          "truePeakDbtp": -1.73
        },
        "platformDerivedVideos": [],
        "verification": {
          "fullDecode": true,
          "sourceUnchanged": true,
          "videoPacketContentPreserved": true,
          "videoEssenceSha256": "e279731e7ac088b188eab6611e3a1e16e52ec66ae6c83b35d1f2d7f6dd985681"
        }
      },
      "remoteReplacementTargets": [
        {
          "platform": "rssCom",
          "assetRole": "podcastAudio",
          "action": "replace_audio_in_existing_episode",
          "status": "verified_remote_replacement",
          "existingId": "c9b853b6-a828-4012-9998-217919ff9163",
          "existingUrl": "https://content.rss.com/episodes/397420/3050766/dr-m-experienced/2026_08_07_05_37_14_57d1a0c9-5f80-4880-bc5d-57f7eeef7cb5.mp3",
          "verification": {
            "verifiedAt": "2026-08-07T06:07:40.834Z",
            "receiptSha256": "063ecadcf46aa53b8649d3bbe56fa679819f4b2e89710d2b3991325c1dc25809",
            "priorUrl": "https://content.rss.com/episodes/397420/3050766/dr-m-experienced/2026_08_06_08_58_14_5ecd30b1-aef2-4666-ad49-f8c0f210fea2.mp3",
            "currentUrl": "https://content.rss.com/episodes/397420/3050766/dr-m-experienced/2026_08_07_05_37_14_57d1a0c9-5f80-4880-bc5d-57f7eeef7cb5.mp3",
            "urlChanged": true,
            "sha256": "9f9402d98ec297cd350e6c6859e1d79459ca5e35ba44bbb4797eb4ef09a1c65b",
            "sizeBytes": 16339867,
            "mediaType": "audio/mpeg",
            "durationSeconds": 1021.204898,
            "bitRate": 128004,
            "integratedLufs": -16.91,
            "truePeakDbtp": -1.98,
            "fullDecodePassed": true
          }
        },
        {
          "platform": "spotify",
          "assetRole": "fullVideo",
          "action": "attach_video_to_existing_rss_episode",
          "status": "pending",
          "existingId": "7cAdb8GE4khC9EYKAjmYuc",
          "existingUrl": "https://open.spotify.com/episode/7cAdb8GE4khC9EYKAjmYuc"
        },
        {
          "platform": "vimeo",
          "assetRole": "fullVideo",
          "action": "replace_existing_video_version_if_supported",
          "status": "pending_capability_confirmation",
          "existingId": "1156414707",
          "existingUrl": "https://vimeo.com/1156414707"
        },
        {
          "platform": "youtube",
          "assetRole": "fullVideo",
          "action": "publish_normalized_replacement_and_retain_prior_unlisted",
          "status": "verified_public_cutover",
          "existingId": "5IMYaqnQsFY",
          "existingUrl": "https://www.youtube.com/watch?v=5IMYaqnQsFY",
          "cutover": {
            "verifiedAt": "2026-08-07T07:46:32Z",
            "currentId": "5IMYaqnQsFY",
            "currentUrl": "https://www.youtube.com/watch?v=5IMYaqnQsFY",
            "priorId": "LXASEw-WFq8",
            "priorUrl": "https://www.youtube.com/watch?v=LXASEw-WFq8",
            "currentVisibility": "public",
            "priorVisibility": "unlisted",
            "publicReadbackVerified": true,
            "metadataVerified": true,
            "thumbnailVerified": true,
            "priorDescriptionLinksToCurrent": true,
            "deletePerformed": false,
            "rollbackEligible": true
          }
        },
        {
          "platform": "rumble",
          "assetRole": "fullVideo",
          "action": "inspect_replace_support_or_stage_unlisted",
          "status": "inspection_required",
          "existingId": "v74kzcw",
          "existingUrl": "https://rumble.com/v74kzcw-episode-1-brain-fog-part-1-is-your-brain-in-a-fog.html"
        },
        {
          "platform": "apple",
          "assetRole": "podcastAudio",
          "action": "rss_fanout_after_rss_com_replacement",
          "status": "pending_rss_fanout",
          "existingId": null,
          "existingUrl": null
        },
        {
          "platform": "amazon",
          "assetRole": "podcastAudio",
          "action": "rss_fanout_after_show_claim",
          "status": "blocked_show_unclaimed",
          "existingId": null,
          "existingUrl": null
        },
        {
          "platform": "instagram",
          "assetRole": "instagramReel",
          "action": "separate_repost_decision_required",
          "status": "not_in_scope",
          "existingId": null,
          "existingUrl": null
        }
      ]
    },
    {
      "number": 2,
      "title": "Brain Fog, Part 2 - Testing and Basic Solutions",
      "rssGuid": "1e40e02b-b217-477c-9cc3-4271cb304c23",
      "publishedAudioBaseline": {
        "measuredAt": "2026-08-06",
        "integratedLufs": -28.42,
        "truePeakDbtp": -6.62,
        "status": "published_pending_replacement"
      },
      "correctedSourceRender": {
        "sha256": "7e138b91dc4c0385420f8b4f75cb316efcc77db8e88ed249b31352dbb6e5ab81",
        "integratedLufs": -22.78,
        "truePeakDbtp": -0.95,
        "measurementEvidenceSha256": "92b06ae1290395573f59a5f887259f502a90c6116bb012e47dc93622e63510f5",
        "decodeEvidenceSha256": "1019e7d49ef7ffd1d41d9dad1692d471fd3284ed744cb1258aee2b761944e2d7",
        "assessment": "under_delivery_target"
      },
      "validatedDelivery": {
        "status": "validated_local_delivery",
        "sourceMode": "validated_v1_candidate",
        "completedAt": "2026-08-06T23:03:42-06:00",
        "masterVideo": {
          "assetId": "episode-002-master-video",
          "sha256": "935ceca9290699c70fe1fc07a2d430113f8a703f2d674742ffd66c412593bb0f",
          "sizeBytes": 1086944676,
          "durationSeconds": 1201.2,
          "integratedLufs": -16.07,
          "truePeakDbtp": -1.29
        },
        "podcastAudio": {
          "assetId": "episode-002-podcast-audio",
          "sha256": "406373597936f206a7b788647fa6ac39301c3e25d9b30d8db7fde571ea80450f",
          "sizeBytes": 28828845,
          "durationSeconds": 1201.176,
          "integratedLufs": -16.33,
          "truePeakDbtp": -1.71
        },
        "platformDerivedVideos": [],
        "verification": {
          "fullDecode": true,
          "sourceUnchanged": true,
          "videoPacketContentPreserved": true,
          "videoEssenceSha256": "52b6f691fd288917e9a0027b05bed095355ef5c02320910cc4f94993190c8339"
        }
      },
      "remoteReplacementTargets": [
        {
          "platform": "rssCom",
          "assetRole": "podcastAudio",
          "action": "replace_audio_in_existing_episode",
          "status": "verified_remote_replacement",
          "existingId": "1e40e02b-b217-477c-9cc3-4271cb304c23",
          "existingUrl": "https://content.rss.com/episodes/397420/3050765/dr-m-experienced/2026_08_07_05_41_20_c5dc584a-9799-404f-96e5-66fd2958ad94.mp3",
          "verification": {
            "verifiedAt": "2026-08-07T06:07:40.834Z",
            "receiptSha256": "063ecadcf46aa53b8649d3bbe56fa679819f4b2e89710d2b3991325c1dc25809",
            "priorUrl": "https://content.rss.com/episodes/397420/3050765/dr-m-experienced/2026_08_06_08_58_12_56d5c865-9d3e-4c15-943c-095c535ffe7b.mp3",